{
  "schema_version": "1.0.0",
  "mission_id": "V2-001I",
  "objective": "Ingest the exact frozen block.monetization.affiliate-offer@0.1.0 specimen into V2, earn V2-owned proof, admit that exact digest, and prove it composes beside Block #1 without changing Foundation Laws.",
  "delegate": "GPT_CONTROL_DIRECT_HOST_EXECUTION",
  "issued_by": "GPT_CONTROL",
  "issued_at": "2026-08-26T16:44:00Z",
  "constraints": [
    "exact frozen 18-file specimen only; digest f87bbdc437fb2f27e80f6e11cf9a9d327d7620218bc312505367dfa085e02c4e",
    "no mutation of legacy othrys-blocks quarry",
    "no Block contract redesign, version bump, provider expansion or feature work",
    "reuse Block #1 admission/lock/mount anatomy; no resolver, registry, package manager or plugin host",
    "prove positive runtime and negative controls: absent, tamper, wrong lock, no legacy fallback",
    "prove coexistence beside admitted block.media.image-prep@0.1.1",
    "admission is allowed only after exact V2-owned specimen tests pass"
  ],
  "expected_proof": [
    "frozen quarry digest independently reverified before ingest",
    "V2 copy byte-identical and digest-identical after ingest and after tests",
    "affiliate Node and Chromium suites pass from V2 canonical home",
    "two-Block oros.lock binds exact versions/digests/provenance",
    "positive two-Block composition and all negative controls pass",
    "clean commit, push and remote SHA verification"
  ]
}
